{
  "schemaVersion": "1.0",
  "decisionId": "sha256:2549f2be7d14a2fe86d118db485b80add4179378f7a7cf177e17b6e8adfdcbee",
  "scenarioSlug": "fast-005a-fraud-investigation-demo",
  "wizardMode": "demo-builder",
  "evaluationStatus": "evaluated",
  "analysisId": "sha256:f35e1312ea83c8815689803b5768d0567c74e471ff848e6e50d913fae937dc10",
  "catalogSnapshotId": "sha256:777873ba1d2beedcb9fb5de2fe85d17c0f5bb20c6fafe5ce674d0de654be8348",
  "recommendedOption": "hybrid",
  "selectedOption": "hybrid",
  "explicitApproval": true,
  "rationale": "Reuse verified investigation foundations while extending external scoring, approvals, and reporting.",
  "selectedPackages": [
    {
      "moduleId": "microsoft-fast:module:core",
      "packageId": "microsoft-fast:package:core:1.2.1.0:managed:f813e8500b97db1fd74f938da28f22ba53c1c4593f6374b34e8a0f7d52e895b3",
      "version": "1.2.1.0",
      "sha256": "f813e8500b97db1fd74f938da28f22ba53c1c4593f6374b34e8a0f7d52e895b3"
    },
    {
      "moduleId": "microsoft-fast:module:investigations",
      "packageId": "microsoft-fast:package:investigations:1.2.1.0:managed:131be1ade134e838e3d824777b6655331a7149eaf80ae14bc26583a4f1bb8391",
      "version": "1.2.1.0",
      "sha256": "131be1ade134e838e3d824777b6655331a7149eaf80ae14bc26583a4f1bb8391"
    }
  ],
  "environmentReadiness": {
    "provided": true,
    "status": "action-required",
    "fresh": false,
    "snapshotMatch": true,
    "packageMatch": true,
    "executionGateOpen": false,
    "environmentUrl": "https://powerplatformvscodestarter.crm9.dynamics.com",
    "coreAssessment": "missing-prerequisites-potentially-available",
    "metadataFingerprint": "7654dbb8de75ccc321fa1959a1546a85016f63a8f3bfca3897c5c055e566ea64",
    "expiresAtUtc": "2026-10-15T20:26:59.6346284Z",
    "limitations": [
      "Environment evidence is absent or stale.",
      "Environment readiness is 'action-required'."
    ]
  },
  "fastDependentExecutionAllowed": false,
  "fullyCustomExecutionAllowed": false,
  "recordedAtUtc": "2026-10-15T21:00:00.0000000Z"
}
